,comment,length,label_id
5580,دوربین ۱۳ هم که دیگه حرفی نمیذاره!,8.0,4
5171,سخت افزارشم کم نظیر وقدرتمنده.,6.0,4
3047,این دوربین از فن آوری iauto در فیلم‌برداری اتوماتیک بهره می‌برد که همان اتوماتیک هوشمند است باعث می‌شود که دوربین به صورت خودکار بتواند نوع صحنه را تشخیص دهد نوردهی دیگر تنظیمات را متناسب با آن قرار دهد.,39.0,3
5630,فلاش led این دوربین فوق‌العاده قدرتمند است.,8.0,4
1388,از لحاظ طراحی، تفاوت محسوسی بین این مدل مدل سال گذشته یعنی galaxy tab ۷٫۰ plus مشاهده نمی‌شود.,20.0,2
5822,سامسونگ بهبود‌های قابل توجهی در این مدل ایجاد کرده است ولی در بعضی از موارد، این تبلت یک پله به عقب رفته است.,23.0,1
1236,در سمت چپ گوشی هیچ شیاری قرار ندارد، اما در سمت مقابل یعنی سمت راست آن، شکاف میکرو سیم کارت، کلید کنترل صدا کلید شاتر دوربین تعبیه شده‌اند.,32.0,2
5740,عملکرد عمومی خیلی سریعی دارد.,6.0,4
1831,به دلیل وجود لنز ۲۵-۴۰۰ میلی متر با توانایی زوم ۱۶ برابر، hx۱۰v به یک دوربین کامپکت سوپرزوم تبدیل شده است.,26.0,2
2293,با سلام گوشی خوبیه من یه دو روزی هست که به دستم رسیده به نسبت قیمتش می‌شه گفت عالیه البته تا الان,22.0,3
3108,در استفاده‌های معمولی تا دو روز می‌توانید با یک بار شارژ باتری از آن استفاده کنید.,17.0,3
6778,من این گوشیو خریدم ولی زود فرختمش شارزش اصلا دوام نمیاره برا همراه بانکم چون منو نداره نمیشه باهاش کار کرد,21.0,0
5042,فاصله فوکوس نزدیک آن هم در مود ماکرو تقریبا سانتی‌متر است که بسیار عالیست به راحتی می‌توانید دوربین را تقریبا به سوژه بچسبانید از آن عکس بگیرید.,28.0,4
452,منم این هارد رو خریدم.,6.0,2
5275,این مرورگر بسیار روان است با سرعت بالایی می‌تواند صفحات اینترنتی را نشان دهد.,15.0,4
126,نهایتا، دوربین به همراه فلاش بلندگو نیز بر روی قاب پشتی گوشی به چشم می‌خورند.,17.0,2
3372,کلیپ‌هایی که ضبط کردیم کیفیت بالایی داشتند هیچ مکثی نیز در این هنگام دیده نمی‌شد.,15.0,3
5024,واقعا حرف نداره به نظر من اگه اندروید ٤.,9.0,4
5464,زومش هم که حرف نداره با آخرین درجه زوم کیفیتش یه ذره هم فرق نمیکنه!,16.0,4
4839,دوربین ۱۳ مگاپیکسلی کیفیت فوق العاده‌ای داره.,8.0,4
4669,در دست گیری آن نیز خیلی راحت می‌باشد به صورت کاملا مطمئن در کف دست شما جای می‌گیرد.,19.0,4
3514,جمع بندی اگرچه nexus از نظر کارایی مشخصات به خوبی آی پد نسل سوم نیست، اما با توجه به قیمت اعجاب انگیز آن امکانات بسیار مناسبی که دارد، می‌تواند حتی به عنوان یک رقیب برای آی پد شناخته شود.,41.0,3
6390,با بزرگنمایی کامل متوجه نویز در مناطق تاریک‌تر می‌شویم.,10.0,1
697,اما پس از خود گوشی نوبت به داک تبلت آن می‌رسد که همراه با گوشی عرضه می‌شود.,18.0,2
4490,مزایاشو میگم: ۱- کیفیت دوربینش خوبه قابل قبول یعنی مطمئن باشید دلتونو نمیزنه ۲-رادیو داره (۴٫۴ اندروید آپدید شده توسط شرکتش فارسی شده) ۳-منوهاش دسترسیش خوبه انصافا ۴-طراحی شیک بدنه ابعاد متناسب ۵- تفاوت چندانی با جی۶۰۰ نداره اما قیمتش پایین تره,46.0,4
2642,موزیک ویدیو پلیر موجود به خوبی فایل‌های مورد نظر شما را در اکثر فرمت‌ها پخش خواهد کرد.,17.0,3
67,این گوشی واقعا گوشی خوبیه ولی فقط یه ایراد کوچیک داره دوربین مکالمه ویدیویش از sl ضعیف تره.,19.0,2
1323,از رقبای اصلی این گوشی می‌توان به samsung galaxy iii lg optimus ۴x hd اشاره کرد که هر یک از آن‌ها مزایا معایب خاصی نسبت به این گوشی دارند.,30.0,2
4194,از همه نظر عالیه.,5.0,4
5030,اگه بهترین گوشی سال نشه (البته اگه اتفاق خاصی نیفته) بی عدالتی کردن توجه داشته باشید که دو هسته‌ای این مدل پردازنده که روی وان اس بود کاملا قابل مقایسه با هسته ای‌ها بود پس همه این پردازنده‌ها رو که تا حالا اومده حتی نوت رو به راحتی پشت سر میگذاره صفحه نمایش هم که مشخصه اون هم که بستگی به سلیقه طرف داره دوربینم که ۱۳ مگاپیکسل تکلیفش معلومه سیستم عاملشم که کاملا مطرحه به ۴٫۱.۱ هم اپدیت شده مدت زیادی قابل استفادست تورو خدا هم حرفی از طراحی برند ال جی نزنید چون اون هم سلیقه‌ای هست اجباری هم توش نیست.,106.0,4
419,در این آزمایش دوربین بالون تا ارتفاع ۱۰۰ هزار پایی اوج گرفتند در دمای ۶۰ درجه زیر صفر سرعتی معادل ۱۵۰ مایل بر ساعت نیز دوربین همچنان به کار خود ادامه داد.,33.0,2
537,امکان چاپ دو رو از خصوصیات دیگر این چاپگر می‌باشد که توانایی چاپ دو رو خودکار تا ۳۰ صفحه را دارد.,22.0,2
2378,وقتی مود عکاسی را بر روی intelligent auto قرار می‌دهید، پس از آن کافیست که دوربین را به سمت سوژه نشانه بروید دکمه‌ی شاتر را بفشارید تا خود دوربین با سنجش شرایط محیطی بهترین با کیفیت‌ترین عکس را تهیه کند.,42.0,3
4763,این دو بلندگو، کیفیتی فراتر از سطح انتظار ما از یک تبلت را ارائه می‌دهند.,17.0,4
2490,از نقاط قوت اصلی صفحه نمایش این لپ‌تاپ‌ها می‌توان به روکش ضد بازتاب آن اشاره آن کرد که به کاربران این امکان را می‌دهد که بتوانند با لپ‌تاپ خود به راحتی در فضاهای پر نور یا در زیر تابش مستقیم نور آفتاب کار کنند.,45.0,3
2454,فیلم برداریش میشه گفت خوبه ولی نه اونقدر.,9.0,3
2230,اما در عرض ۴۰ دقیقه شارژ میشه.,8.0,3
6817,مصرف باطری فوق العاده بالا است.,7.0,0
2092,در میان قاب پلاستیکی پشت این تبلت علاوه بر بلندگو، لوگوی nexus با اندازه‌ای بزرگ همچنین لوگوی asus با اندازه‌ای کوچک‌تر خودنمایی می‌کنند جلوه بهتری به این تبلت بخشیده‌اند.,31.0,3
1468,نتیجه چهره‌ای منظم است ولی نه ساده!,8.0,2
6727,با وجود رقبای سر سختی مانند samsung galaxy iii htc one به نظر می‌رسید اپل برای تبدیل شدن به بهترین، کار بسیار سختی را در پیش دارد.,29.0,0
1651,مدل‌های hx۳۰v، hx۲۰v hx۱۰v.,12.0,2
4864,در ضمن مصرف انرژی g۵۸۵ نیز بسیار پایین است باتری ۴۸ وات ساعتی آن می‌تواند با یک بار شارژ کامل تا چهار ساعت به طور مداوم ویدیو پخش کند.,31.0,4
5749,نسبت به قیمتش امکاناتش حرف نداره.,7.0,4
1133,اگه تو یک کلمه بخوام بگم.,7.0,2
4600,این لنز در حالت واید میدان دید خیلی گسترده‌ای را پوشش می‌دهد که عالیست.,15.0,4
5288,میزان غلظت رنگ‌ها وضوح جزئیات نیز بسیار مناسب می‌باشند.,10.0,4
5663,بارزترین ویژگی آیپاد نانو ابعاد فوق العاده کوچک (۳۷٫۵*۴۰٫۹*۸٫۷۸) صفحه multi-touch آن است.,20.0,4
4677,از لحاظ باتری واقعا عالیه.,6.0,4
1595,منم تازه خریدمش.,4.0,2
4414,همچنین یک پردازشگر گرافیکی adreno ۲۲۵ به همراه یک گیگابایت حافظه‌ی رم باعث می‌گردند که این گوشی جزو قوی‌ترین گوشی‌ها قرار گیرد.,23.0,4
1182,از دیگر قابلیت‌های این دوربین می‌توان به لرزشگیر دست، قابلیت تشخیص چهره قابلیت ثبت موقعیت مکانی زمانی عکس‌ها اشاره کرد.,22.0,2
5958,این به این معناست که از صفحه نمایش آن نمی‌توان انتظار تصویر چندان خوبی در مقابل صفحه نمایش‌های super amoled یا super clear lcd را داشت.,27.0,1
4145,سلام گوشی خیلی خیلی خوبیه.,6.0,4
5731,سرعت بلوتوث هم خیلی عالیه.,6.0,4
1668,این امر را در حین کار کردن با گوشی‌های تولید اپل راحتی کار با یک دست با آن‌ها احساس خواهید نمود.,21.0,2
6231,ولی برای کسانی که از امکانات اینجور گوشی‌ها استفاده می‌کنن، اتصال به اینترنت جهت تنظیمات فعال سازی‌های اولیه، الزامیه بدون وصل شدن به اینترنت، استفاده کامل از تمامی اپلیکیشن‌ها امکان پذیر نیست.,36.0,1
1421,همه از این گوشی تعریف کردن تقریبا میشه گفت که نظرات همه دقیقه.,14.0,2
4223,در کل عملکرد همه‌ی دکمه‌ها با برچسب‌هایی؛ خیلی خوب نمایش داده شده است.,13.0,4
626,از زاویه‌ی عمودی خیلی زود کیفیت خراب می‌شود ولی از زاویه‌ی افقی وضعیت کاملا بهتر است.,17.0,2
2354,شما می‌توانید عکس هایی که گرفته‌اید را به صورت بیسیم به گوشی هوشمند، تبلت یا لپ تاپ خود منتقل کنید یا اینکه برای پرینت مستقیم به یک پرینتر ارسال نمایید.,32.0,3
3439,با این حال اگر از باتری سلولی بر روی آن استفاده شده بود، باز هم شارژدهی بیشتری را از آن شاهد بودیم.,23.0,3
1267,من اولین گوشی هوشمندی است که گرفتم.,8.0,2
6107,از htc butterfly سره کسی که اکسپریاz رو بخره به هیچ وجه ضرر نکرده,14.0,1
6278,سلام من این پرینترو از یه نمایندگی hp گرفتم بدون گارانتی متاسفانه ماه بعد از استفاده هدش سوخت کلا دستگاه بدون استفاده شد هدش رو با کلی درد سر گیر آوردم ولی قیمتش نصف قیمت دستگاه بود از خریدش منصرف شدم الان فقط اسکنش کار میکنه پیشنهاد میکنم پرینتر لیزری بخرین ممکن وقت خرید پول بیشتری رو پرداخت کنین ولی خیالتون از خیلی از جهات راحت میشه.,68.0,1
834,به علاوه خروجی تصویری hdmi پورت شبکه ethernet نیز وجود دارند.,12.0,2
1795,اما به هر حال برای ویندوز rt به اندازه ویندوز سون برنامه بازی وجود ندارد برای لذت بردن از آن، باید کمی صبر کرد تا به مرور بر تعداد برنامه‌های سازگار با ویندوز آر تی اضافه گردد.,39.0,2
1893,از نظر قدرت عکاسی نیز این گوشی عملکرد بسیار خوبی را به کاربر ارائه می‌نماید.,16.0,2
2321,این دستگاه در مقابل قیمتش بی نظیره شارژدهی فوق العاده‌ای داره بسیاری از بازی‌های روز را با همین گرافیک اینتل می‌توان انجام داد.,24.0,3
3428,همچنان که با آن به راحتی می‌توانید به عکاسی زیر آب نیز بپردازید.,14.0,3
2004,با اینکه صفحه نمایش این گوشی لمسی نیست، ولی کیبورد qwerty این گوشی می‌تواند تا حدودی باعث شود که لمسی نبودن صفحه کلید چندان شما را نا امید نکند.,31.0,3
2846,با سلام من یک هفته میشه که این گوشی رو گرفتم از هر نظر عالی هستش تو خریدش شک نکنید,20.0,3
2731,بدون شک در حال حاضر بهترین گوشی دو سیم کارت موجود در بازار هست.,15.0,3
4384,این صفحه نمایش تمامی جزئیات را با دقت فوق العاده بالایی نشان می‌دهد، رنگ‌ها بسیار غنی زنده روشنایی زاویه دید این صفحه نمایش بسیار عالی هستند.,28.0,4
5527,امروز تحویل گرفتم تا حالا عالی بوده.,8.0,4
743,نصب خودکار برنامه‌ها: پاره‌ای از نرم‌افزارها برای نصب کامل اکتیو شدن نیاز به فایل‌هایی دارند که باید با نسخه اصلی جایگزین شوند.,24.0,2
6547,بسیار خوب، st۶۸ کمی گران قیمت‌تر است که به دلیل سنسور تصویر با رزولوشن دو مگاپیکسل بیشتر آن می‌باشد.,22.0,1
148,چون کیفیت دوربینش hd هستش فضای زیادی برای فیلم برداری عکس برداری اشغال میکنه!,15.0,2
605,اما اگر با دقت بیشتری به این دوربین نگاه کنیم، باید گفت که سنسور تصویر ۱۰ مگاپیکسلی ccd سایز ۱/۱٫۷ اینچی p۷۱۰۰ با یک سنسور ۱۲٫۱ مگاپیکسلی cmos با همان سایز تعویض شده است.,38.0,2
4598,به همین دلیل نیز گستره‌ی حساسیت سنسور این دوربین از ۱۰۰ تا ۳۲۰۰ می‌باشد که بسیار خوب است.,19.0,4
6685,با این حال اسکن فیلم ۳۵ میلی متری از نویز در قسمت‌های تاریک‌تر سایه‌ها رنج می‌برد.,17.0,1
2237,تقریبا همه بازی‌های موجود برای اندروید بر روی این گوشی اجرا می‌شوند، فقط ممکن است در بعضی از بازی‌های با گرافیک بسیار بالا، ناهنجاری‌هایی مشاهده نمایید که قابل چشم پوشی است.,34.0,3
2824,htc در ارائه گوشی‌های میتنی بر اندرید از رقبا داره میزنه جلو تا حالا شرکت دیگری اندرید ارزان قیمت نداده,20.0,3
41,نمایشگر این گوشی ۳٫۵ اینچی با رزولوشن hvga است.,10.0,2
4859,اما رنگ‌ها خیلی خوب به نظر می‌رسند غلظت ملایمی دارند.,11.0,4
1517,به صورتی که توانایی کپی کردن، اسکن، فکس، پرینت عکس، پرینت دورو، قابلیت اتصال از طریق bluetooth wifi را نیز باید داشته باشد.,28.0,2
5027,قطر آن هم که چیزی در حد یک شگفتی است، چرا که حدود میلی متر از هر دوی آن‌ها باریک‌تر است.,23.0,4
6286,متاسفانه هیچ کدام از این جلوه‌ها در هنگام ضبط ویدیویی قابلیت اعمال ندارند.,14.0,1
1322,دوربین ۶۰۰d هم به همین گونه است.,9.0,2
567,چند دوربین قبلی عکاسی پیاپی با سرعت حدود ۳٫۷ فریم بر ثانیه را ارائه می‌کردند.,16.0,2
1921,قابلیت نصب فلاش.,4.0,2
4243,دنیایی که جذابیتهای فوق العاده خودش را دارد از آنجا که kinect نسبت به رقبایش (ps۳ move nintendo wii) مطلوبیت بیشتری دارد راحت‌تر نیز می‌توان از آن استفاده نمود، بنابر این به شما توصیه می‌کنیم لذت استفاده از kinect xbox ۳۶۰ را حداقل یکبار تجربه کنید.,50.0,4
5236,به نظر من این گوشی با قابلیت هایی که داره خریدنش عالیه هم چنین در مقایسه با گوشی هایی دیگر مثل sony sl من که حتما با ید این رو بخرم,31.0,4
5170,همانند عکس‌های گرفته شده، کیفیت فیلمبرداری این گوشی نیز بسیار خوب رضایت بخش است.,16.0,4
558,گوگل نیز در لیست لوازم جانبی این گوشی یک وسیله به نام google wireless charging orb قرار داده است که ظاهری شبیه به یک نیم کره دارد می‌توان با قرار دادن nexus بر روی آن از طریق ارتباط بی سیم، باتری گوشی را شارژ کرد.,46.0,2
2476,این پرینتر به شما اجازه استفاده از کارت حافظه برای پرینت مستقیم از روی آن پیش نمایش عکس‌ها بر روی نمایشگر رنگی ۲٫۴ اینچی را می‌دهد.,27.0,3
3651,مخصوص که فول اچ دی هست بهره گیری از لنز واید با کمینه‌ی نسبت کانونی f/۲٫۷ مخصوص عکس برداری در نور کم شب هستش که کیفیت خوبی به عکس میده در کل دوربین خوبی هست منو کاملی داره,38.0,3
380,برای گفتن جزئیات تمامی تغییرات عملکرد‌های ios نیاز به نوشتن یک نقد بررسی جداگانه می‌باشد.,16.0,2
4678,این سیستم عامل به خودی خود، پیشرفت‌های زیادی نسبت به نسخه‌های پیشین داشته است htc با قرار دادن جدیدترین رابط کاربری خود با نام sense plus این بهبودها را دو چندان کرده است.,33.0,4
827,اینکه کار کردن با منوها از طریق نمایشگر چقدر ساده یا چقدر مشکل است.,15.0,2
1830,باور ندارید میتونید در دیجی کالا این دو را مقایسه کنید.,12.0,2
2199,همانند مدل پیشین، نمایشگر این دوربین هم کاملا چرخنده لمسی است.,13.0,3
3539,حتی صدای اسپیکرهای این نوت‌بوک نیز ما را تحت تاثیر خود قرار داد.,14.0,3
6785,شایعاتی که قبل از ورود این گوشی به عرصه گوشی‌های فوق مدرن منتشر شد توقعات کاربران رو بالا برد به طوریکه با معرفی این گوشی هیچ چیز اعجاب آوری در آن دیده نشد در صورتی که رئیس بخش foxconn گفته بود گوشی آیفون دارندگان گلکسی s۳ رو خجالت زده میکند,48.0,0
1019,بشکه لنز آن به دلیل لنز غول پیکری که درون آن قرار گرفته همواره بیرون زده است.,17.0,2
2071,ولی htc این گوشی را به عنوان پرچمدار نمیشناسد پرچمدار خود را بعد از onex+ به m۷ تغییر داد.,20.0,3
5837,شارژ بی سیم (که یک تکنولوژی تازه محسوب نمیشود آن را در لومیا ۹۲۰ نوکیا هم دیده بودیم) خلاصه من iphone ۴s که محصول یک سال پیش شرکت اپل است را به محصول چند روز پیش گوگل الجی ترجیح میدهم!,42.0,1
4615,فوق العادست این گوشی با این قیمت.,8.0,4
1605,علاوه بر دوربین، بلندگوی گوشی لوگوی beats audio نیز در این قسمت قابل مشاهده هستند.,17.0,2
722,صفحه نمایشصفحه نمایش موجود بر روی این گوشی یک صفحه نمایش اینچی لمسی خازنی از نوع tft می‌باشد.,19.0,2
3851,تماشای فیلم از طریق usb با قابلیت connectshare movie کافی است که حافظه خارجی خود را به تلویزیون وصل کرده فورا از فیلم‌ها، عکس‌ها یا آهنگ‌های دلخواه خود لذت ببرید.,32.0,3
2188,طراحی اکثر بخش‌های بدنه دستگاه از پلاستیک مات ساخته شده به همین دلیل بازتاب نور کمی دارد در مجموع ظاهر نوت‌بوک بسیار مناسب است.,25.0,3
3559,من به همه توصیه میکنم,5.0,3
3785,ابعاد عکس‌های ثبت شده با این گوشی ۲۴۴۸×۳۲۶۴ پیکسل می‌باشد.,13.0,3
3569,می‌خوره وزن بد نیست تنظیمات دستی خوبی داره فرمت راو نداره یا ندیدم درکل توصیه به کسایی بودجه دوربین حرفه‌ای یا حوصله لوازم لنز و.,26.0,3
32,این دوربین تنها دارای یک شیار کارت حافظه است این در حالیست که canon vixia g۱۰ دو شیار کارت حافظه دارد.,23.0,2
5048,این کمینه‌ی نسبت کانونی بسیار عالی، به شما اجازه می‌دهد که بتوانید در شرایط نوری نزدیک به تاریکی هم با سرعت‌های شاتر بالاتر عکاسی کنید.,27.0,4
5417,تصاویر گرفته شده با دوربین این تبلت کیفیت فوق‌العاده بالایی دارند.,12.0,4
6495,فقط فقط قاب گوشی کیفیت ساختش کمه از کنار دوربین همیشه یه ترک جزئی بر میداره!,17.0,1
5574,باید بگم عالیه بی نظیر واقعا معرکه است,8.0,4
1865,اما به یکی دیگر از تغییرات اساسی آیفون می‌رسیم، یعنی تغییر در کانکتور.,15.0,2
5590,در حقیقت در این شوتینگ مود می‌توانید همه‌ی پارامترهای نوردهی از جمله سرعت شاتر، دیافراگم، ‌ایزو همه دیگر تنظیمات را بر عهده بگیرید تا کاملا حرفه‌ای، دلخواه خلاقانه عکاسی کنید.,34.0,4
4644,بدین ترتیب که مثلا اگر دوربین را بر روی مود sr auto قرار دهید، به یک دوربین کاملا خودکار در عکاسی تبدیل می‌شود، کافیست که آن را به سوی سوژه نشانه بروید دکمه‌ی شاتر را بفشارید تا دوربین خود به صورت هوشمند نوع صحنه، شرایط نوری، نقاط فوکوس دیگر پارامترها را تشخیص دهد همه‌ی تنظیمات را بر روی بهترین حالت قرار دهد تا بهترین با کیفیت‌ترین عکس تولید شود.,74.0,4
6476,سطح امنیت تشخیص چهره به اندازه ورود با شناسه اسم رمز بالا نیست.,14.0,1
5966,padfone در سه مدل ۱۶، ۳۲ ۶۴ گیگابایتی وجود دارد ولی متاسفانه این گوشی از کارت‌های حافظه microsd پشتیبانی نمی‌کند.,22.0,1
2146,همچنین با بهره گیری از فناوری wi-fi امکان اتصال به اینترنت با سرعت بالا بر روی این تبلت وجود دارد.,21.0,3
4919,کلا تو این رنج قیمت یکی از بهترین گوشی هاست,10.0,4
2727,صفحه نمایش بالاخره اپل دست از اصرار برای تولید صفحه نمایش ۳٫۵ اینچی برداشت!,15.0,3
2813,این دو دوربین از نوع نشانه عکس یا point to shoot می‌باشند.,13.0,3
880,از کنترل چرخنده جلوی دوربین هم دیگر خبری نیست.,10.0,2
20,پس حتما ادامه‌ی نقد بررسی را بخوانید!,8.0,2
3079,امیدوارم نسخه تک سیمکارته این گوشی که شارژ بیشتری نگه میدارد آنهم در رنگ‌های متنوع مخصوصا سفید وارد کشور شود.,21.0,3
3884,بعلاوه اینکه عکاسی پیاپی آن نیز با سرعت ۵٫۵ فریم بر ثانیه از ۴٫۵ فریم بر ثانیه ۶d برتر است.,21.0,3
3615,حتی در مصارف سنگین‌تر، galaxy tab می‌تواند حداقل یک روز کامل را شارژ دهی کند.,17.0,3
5712,همان‌طور که در ابتدا گفتیم، retina macbook pro تلفیقی از گذشته آینده است که تبدیل به یک دستگاه دوست داشتنی، زیبا، قدرتمند کم نظیر شده است برای کسانی طراحی شده است که به دنبال بهترین بهترین‌ها هستند حاضرند بهای آن را نیز پرداخت کنند.,46.0,4
