,comment,length,label_id
3155,فکر کنم الان ارزش خرید رو داشته باشه قیمتش مناسب‌تر شده باتشکر از دیجی کالا,15.0,3
501,کانن بر روی این دوربین از سنسوری هیبریدی استفاده کرده که از آن با نام نسخه سنسورهای تصویر هیبریدی نام برده شده است.,22.0,2
1675,پس از پر شدن ظرفیت حافظه‌ی داخلی می‌توانید بر روی کارت حافظه‌ی sd/sdhc/sdxc فیلم برداری را ادامه دهید.,19.0,2
1630,یه همچین گوشی حداقل به یه cpu ۸۰۰ mh نیاز داره.,12.0,2
4273,این گوشی در رنگ‌های بسیار متنوعی طراحی شده در جعبه‌ی آن دو قاب رنگی قابل تعویض هم وجود دارند تا به راحتی بر این تنوع بیفزایید.,27.0,4
838,دکمه‌ی پاور یا همان دکمه‌ی روشن خاموش به قسمت پشتی دوربین انتقال یافته است.,14.0,2
6626,عکاسی سه بعدی هم نمی‌توانید بکنید.,7.0,1
5099,عملکرد lcd لمسی هم بسیار خوب هست.,8.0,4
727,در دست احساس خوبی را به شما می‌دهد، البته احتمالا کمی زمان می‌برد به آن عادت کنید چرا که برخلاف گوشی ۳g ۳gs پشت آن خمیده نیست.,29.0,2
939,این واقعیتی است که اپل آن را در مراسم معرفی iphone اعلام کرد.,14.0,2
414,سرعت چاپ در حالت سیاه سفید در حدود ۸٫۷ صفحه در دقیقه برای حالت رنگی صفحه در دقیقه می‌باشد.,20.0,2
1264,تایم لپس نیز همچنان موجود می‌باشد.,7.0,2
3661,کیفیت چاپش خوبه.,4.0,3
3938,جمع بندی صفحه نمایش با کیفیت، شفاف روشن infinity آن را به یک جانشین عالی برای transformer prime تبدیل کرده است.,22.0,4
4310,در نقد بررسی hx۱۰۰v اشاره کرده بودیم که کیفیت عکس‌های گرفته شده فوق‌العاده هستند.,16.0,4
273,همان طور که میدانید اسکنرها از ابتدا تا کنون نه فقط در حوزه فنی بلکه در ابعاد اندازه نیز تغییرات فراوانی داشته‌اند.,23.0,2
2280,دوربینی مناسب کار‌های معمولی است,5.0,3
5511,با سلام من تجربه استفاده از خیلی گوشی‌های سونی اریکسون سونی رو تا به الان داشتم این گوشی رو به تازگی خریدم به جرات میگم بهترین گوشی sony تا به الان این گوشی هست.,35.0,4
5328,سرعت فوکوس خودکار آن نیز چه در مود live view هنگام فیلم برداری چه غیر از آن فوق العاده مثال زدنی است.,23.0,4
1880,گوشی دوسیم کارتی اچ تی سی با اندروید۴.,9.0,2
1948,اما همانطور که گفتیم، در قسمت بالای این دوربین یک پیچ تنظیم مشاهده می‌شود.,16.0,2
6666,مثلا در ایفون نمیشه هر لحظه مثل سیستم عامل اندروید نرم افزار اضافه نمود حتما باید به کامپیوتر وصل بشه ویک سری محدودیتهای دیگر مثل انتن ندادن ایفون در بعضی از مکانها که شامل سونی اریکسون نوکیا نمیشه در کل ایفون یعنی بازی ای پد بهتر از خرید ایفون هست.,51.0,1
444,اما تفاوت اصلی این گوشی با مدل xperia در اندازه آن‌هاست که به علت تفاوت سایز صفحه نمایش، بوجود آمده است.,22.0,2
2192,در قسمت زیرین دستگاه دو بلندگوی استریو قرار دارند که کیفیت مناسبی دارند از رقبای هم قیمت g۵۸۵، بهتر می‌باشند.,23.0,3
6257,این آنتن بهتر بود که به صورت داخلی ساخته می‌شد.,10.0,1
4149,خیلی قویه..,4.0,4
1632,در ضمن در سمت راست کیبورد g۵۸۵، بخش عددی جداگانه یا numpad نیز قرار دارد.,18.0,2
1786,چون دراثراستفاده ناصحیح پین‌های mini usb خود کابل دچارمشکل میشه باعث قطع وصل مکرر آسیب هارد میشه مجبوریم کابل دیگه‌ای تهیه کنیم.,23.0,2
1407,همچنین میانبر قابل تغییر نیز وجود دارند که می‌توان آن‌ها را به هر برنامه‌ای تخصیص داد.,17.0,2
3219,اونم گوشی که مشابه سخت افزار شو میشه تویه گوشی‌های دیگه پیدا کرد حتی بالاتر,15.0,3
987,من عاشق دیجی کالا هستم هر روز واردش میشم.,10.0,2
1336,نمیدونم چرا باتریش جزو نقاط ضعفش اومده.,8.0,2
3351,در مجموع می‌توانیم بگوییم که سامسونگ از صفحات نمایشی فراتر از انتظار ما از یک لپ ‌تاپ ارزان قیمت، در ساخت سری استفاده کرده است.,26.0,3
3759,اگر نداشته باشید تلوزیون اصلا کاربرد نداره ۲. این تلوزیون بسیار خوبی است ولی تو ایران زیاد کار آمد نیست زیرا بیشتر برنامه‌های کاربردیش مثل برنامه اصلی ورزش تلوزیون فیلتر است نمی‌تونید از برنامه‌های کاربردی ان استفاده کنید (البته ایران خودش چند تا برنامه بازی عالی در سامسونگ اپس گذاشته است) در پایان باید به مرورگر خود تلوزیون بپردازم که واقعا عالیه من از اون راضی بودم ولی اگر کاربران بتوانند برای راحتی خودشون یک کیبرد موس بی سیم هم بگیرند راحت‌تر می‌توانند از مرورگر استفاده کنند کیفیت تلوزیون که برای شبکه‌های ایران کیفیت خوبی ندارد ولی برای فیلم‌های فول اچ دی عالیه امیدوارم تونسته باشم راهنماییتون کرده باشم,108.0,3
611,ولی اگر تمایل به گوش کردن به موسیقی یا تماشای ویدئو با صدای بلند دارید، پیشنهاد می‌کنیم که از هدفون یا از بلندگوهای خارجی استفاده کنید.,28.0,2
5174,من با این گوشی حدودا هفته کار کردم واقعا نسبت به iphone هم انتن دهی بهتری داره هم تاچش خیلی بهتر شده واقعا عالیه,24.0,4
84,منم این هارد رو دوشنبه سفارش دادم چهارشنبه رسید دستم,10.0,2
5452,صفحه نمایش اینچی با کیفیت فوق‌العاده در کنار پردازنده قدرتمند به شما این امکان را می‌دهد تا از بهترین تجربه کاری با تمامی برنامه‌ها بازی‌های سیستم عامل ios بهره‌مند شوید.,31.0,4
1593,بسیار خوب، st۶۸ کمی گران قیمت‌تر است که به دلیل سنسور تصویر با رزولوشن دو مگاپیکسل بیشتر آن می‌باشد.,22.0,2
2715,اگر میگن این گوشی باتریش ضعیفه جیو اصلا باتری نداره.,11.0,3
85,همه چی عالی ولی باطریش ضعیفه مدام شارژ میخواد ولی کیفیت عکساش توپه.,14.0,2
5692,فیلم‌برداری xperia tx نیز شرایط یکسانی دارد بسیار خوب است.,11.0,4
1087,با اینکه در کل مانند همگی محصولات اپل، این گوشی نیز از بهترین مواد تشکیل شده است اما بدنه آلومینیومی آن به راحتی خراشیده می‌شود احتیاج به مراقبت بیشتری دارد، که البته با قرار دادن یک محافظ بر روی آن این مشکل به طور کلی برطرف می‌گردد.,49.0,2
3839,. اصلا در خریدش شک نکنن چون واسه این اشخاص خیلی خوبه.,13.0,3
1285,البته این فقط در مود jpeg کار می‌کند.,9.0,2
5342,مسلما همکاری سامسونگ با کمپانی معتبر wacom در زمینه ساخت قلم باعث گردیده که قلم‌های ساخت سامسونگ عملکرد فوق‌العاده خوبی داشته باشند که در مورد این قلم نیز این‌چنین است.,30.0,4
3282,چنین دوربینی کاملا می‌تواند استفاده‌ی حرفه‌ای داشته باشد مورد علاقه‌ی بسیاری از عکاسان قرار گیرد.,15.0,3
700,هرچه کنتراست بیشتر باشد رنگ مشکی تاریک‌تر رنگ سفید روشن‌تری خواهیم داشت، بنابراین تصویر با کیفیت بالا نمایش داده خواهد شد.,20.0,2
2929,از آن جایی که یک دوربین فیلم برداری آماتوری است، بنابراین مجهز به مود فیلم برداری اتوماتیک هوشمند یا همان smart auto می‌باشد.,25.0,3
2404,به دلیل موجود بودن در کانفیگ‌های گوناگون، لپ‌تاپ‌های سری می‌توانند هر نوع کاربری را راضی نگاه دارند.,19.0,3
1134,اما elph ۵۲۰ hs نیز همانند بیشتر دوربین‌های هم رده، یک دوربین point to shoot است.,18.0,2
401,سیستم عامل این مدل، نسخه ۲٫۳ از سیستم عامل اندروید می‌باشد که همراه با رابط کاربری ال‌جی با نام s-class بر روی گوشی قرار گرفته است.,27.0,2
368,سخت افزار متاسفانه کمپانی نوکیا در مورد قطعات داخلی این گوشی اطلاعات چندانی را منتشر ننموده است، اما به هر حال برای یک گوشی دارای سیستم عامل s۴۰ سخت افزار قوی اهمیتی ندارد.,35.0,2
6595,این کار در واقع سر صدای زیادی را‌ ایجاد می‌کند live view هم برای لحظه‌ای قطع می‌شود.,18.0,1
3949,این در حالیست که فیلم برداری ۷۲۰p hd با سرعت فوق العاده ۱۲۰ فریم بر ثانیه انجام می‌گیرد بدین ترتیب می‌توانید از لحظات ورزشی خود فیلم‌های hd اسلوموشن هم داشته باشید!,32.0,4
1526,سلام به همه دوستان که خریدار این دوربین هستن من ماه پیش با کلی تحقیق این سایت اون سایت گشتن با بودجه‌ای که داشتم تصمیم گرفتم sx۴۰ بخرم واقعا ازش راضیم برای کسی که مبتدیه میخواد کارشو شروع کنه تو عکاسی عالیه میگن ۱۲٫۱ ولی خیلی کیفیتش خوبه یه زومش: عالیه چون مثلا یه فاصله خیلی دور میاری نزدیک بعد با کیفیت عجیب عکس میگیره ادم خیلی لذت میبره مثلا فاصله تا ۱کیلومترو (تو طبیعت) میاری جلو نزدیک نزدیک بعد یه عکس با کیفیت بالا خیلی زومش جالبه ولی جدا از زوم هیچ کمبودی نداره با قیمت روز به نظرم می‌ارزه حالا امروز امدم تو سایت دیدم sx۵۰ آمده شاید قبلا بوده من ندیدم من که تازه دیدم یه مقایسه کردم با مدله قبلیش هیچ تغییره محسوسی نکرده ایزوش خیلی خوب شده قبول دارم زومش ۳۵ که فوق العادست پس ۵۰ چی میتونه باشه (فکر نکنم نیاز بشه) فقط تنها فکر کنم چیزی که سرتر با فرمت raw ذخیره میکنه که مدله قبلش نیست بعضی جاها هم sx۴۰ سرتره حالا باز تصمیم با خودتونه اگه اختلاف قیمتشون براتون مهم نیست زیاد sx۵۰ خوبه ولی اگه نه جدی دارم میگم زیاد تفاوت نداره شک نکن sx۴۰,206.0,2
2013,یه گوشی عالی ولی یکم لقه در کل بگم خوبه,10.0,3
6810,با حافظه ۱۶ گیگ (که فقط گیگ اون پر شده) خیلی کند شده مدام هنگ می‌کنه.,19.0,0
6303,وقتی این گوشی را برای اولین بار در دست میگیرید، انتظار وزنی بیشتر ساختاری فلزی مستحکم‌تر را دارید، ممکن است در وهله اول کمی شما را مأیوس کند.,31.0,1
2641,در این رابط کاربری، امکان عکاسی در حالت‌های مختلف را خواهید داشت.,13.0,3
4843,فایل‌ها برنامه‌های خود را به اشتراک گذاشته، ذخیره ساخته از آن‌ها لذت ببرید راحت‌تر از همیشهبه یمن وجود قابلیت‌های ارتباطی هوشمند می‌توانید تجربه مشاهده لذت بخش‌تر هوشمندانه‌تری داشته باشید.,30.0,4
378,اثر هر کدام را همان جا می‌توانید به صورت زنده مشاهده کنید تا دیگر نیازی به گرفتن عکس برای تست هرکدام نباشد.,23.0,2
3595,به نظر من که با توجه امکاناتش قیمتش خیلی مناسبه.,11.0,3
5760,به هر صورت همانطور که گفتیم، hx۱۰v یکی از پیشرفته‌ترین، پر امکانات‌ترین خوش ساخت‌ترین دوربین‌های کامپکت سوپرزومی است که تا به حال دیده‌ایم.,28.0,4
6085,۴- این گوشی دارای خروجی تلویزیون tv-out یا hdmi نیست (مثل اینکه در میان گوشیهای دو سیم کارته اپیدمی است).,23.0,1
793,نمایشگر این گوشی ۳٫۵ اینچی با رزولوشن hvga است.,10.0,2
800,برای کسی که اندازه واسش مهم نیست عالیه ولی من ایپد مینی رو پیشنهاد میکنم واسه اونایی که یه تبلت جمع جور احتیاج دارن با تشکر از دیجی کالا,29.0,2
1095,این گوشی رو از دی جی کالا خریدم امروز رسید دستم.,12.0,2
916,سفارش دادم زیاد بررسی کردم تا تصمیم گرفتم بخرم دستم برسه میام نقد میکنم,14.0,2
6254,در ضمن در مورد باطری این رو هم بگم که مسلما باطری ضعیفه چون این توان انرژی رسانی به صفحه نمایش با این همه تعداد پیکسل رو که خودش هم از جنس ال سی دی پر مصرف هست رو تا بیشتر از یا ساعت نداشته باشه.,47.0,1
1216,کیفیت عملکرد واقعی ممکن است بسته به مشخصات فنی مدل‌ها محدودیت‌های سخت‌افزاری متفاوت باشد.,15.0,2
1423,در آینده با به بازار آمدن این دوربین سعی می‌کنیم آپدیت هایی را بر روی این نقد بررسی اعمال کنیم.,21.0,2
1752,به عنوان مثال اگر سیستم شما ویروسی باشد یا دچار مشکلات رجیستری باشد نتوانید net framework را نصب کنید در نتیجه قادر نخواهید بود اصولا اتوران آن مجموعه را ببینید درنتیجه قادر به نصب هیچ برنامه دیگری از روی دی وی دی‌ها هم نخواهید بود.,44.0,2
5393,"من این هارد رو سه روز پیش سفارش دادم امروز رسید دستم سرعتش عالیه, نرم افزاری که روی خودش هست خیلی به کار میاد اگر به دنبال یه هارد همه چی تموم میگردین این عالیه شک نکنین.",38.0,4
3498,اگرچه این گوشی از لحاظ سخت افزاری چندان قوی نیست اما رابط کاربری ساده جذاب، طراحی زیبا قیمت رقابتی این گوشی آن را به گزینه‌ای مناسب در بین گوشی‌های هم رده خود بدل می‌کند.,36.0,3
6357,من از این سایت دوربینو خریداری کردم این دوربین زوم بسیار بالا قوی داره ولی متاسفانه تراکم پیکسلیش پایینه,19.0,1
4015,نتیجه تست‌های مختلف صورت گرفته توسط سایت معتبر آناندتک نشان می‌دهد که باز هم باید آیفون را قدرتمندترین گوشی موجود تا به امروز بنامیم.,25.0,4
366,بررسی اجمالی بر روی این دوربین داشتیم ولی سعی می‌کنیم که به هنگام به بازار آمدن این دوربین نقدی عمیق‌تر هم بر روی آن ارایه دهیم.,27.0,2
781,از نظر ظاهری هم ۶۰۰d بسیار شبیه به دوربین مدل پیشین خود یعنی ۵۵۰d می‌باشد فقط تغییراتی جزئی را شاهد هستیم که آن هم برای سازگاری با نمایشگر چرخنده بوده است.,33.0,2
6042,در تست استاندارد مرورگری اینترنت از طریق wi-fi، مدل‌های مختلف با توجه به سایز صفحه نمایش نوع پردازنده پردازشگر گرافیکی، توانستند بین تا ۳:۳۰ ساعت شارژدهی کنند که در مقایسه با آلترابوک‌ها سایر لپ تاپ‌های باریک، میزان نسبتا ضعیفی محسوب می‌گردد.,45.0,1
2619,اندودی که سامسونگ بر روی شیشه‌ی نمایشگر به کار برده وظیفه‌ی خود را به خوبی انجام می‌دهد.,18.0,3
6360,والا ۵۱۰۰ نیکون هم انتخاب خوبیه بدیش محدودیت دقیقه‌ای ضبط ویدئو است.,13.0,1
4125,فیلمبرداری فوق العاده عکس‌های واضح با نویز کم شما رو شگفت زده میکنه.,14.0,4
5812,هرچند که ۶d برای کاربران dslr‌های aps-c که وسوسه ارتقاء به فول فریم را دارند ساخته شده، ولی به هر صورت به عنوان دوربینی فول فریم، لنزهای ef-s که مخصوص aps-c‌ها ساخته شده‌اند بر روی این دوربین جوابگو نیستند.,42.0,1
361,اما این کار فقط تا ۱٫۵ ثانیه ۱۵ عکس می‌تواند صورت گیرد.,13.0,2
304,قبل‌تر در نقد بررسی برادر بزرگ‌تر این تبلت یعنی note ۱۰٫۱ در مورد قابلیت لمس شناور توضیح دادیم، بر طبق این قابلیت، شما برای اینکه به دستگاه بفهمانید که به کدام نقطه اشاره می‌کنید لازم نیست که حتما آن‌را لمس نمایید با مقداری فاصله نیز دستورات را درک می‌نماید.,53.0,2
6130,دیگه حرفی نداشت البته با کیفیت دوربین دوم میتوان کنار اومد اما باطریش ضعیفه آخه چرا هیچ شرکتی تو دنیا یه گوشی کامل بی نقص تولید نمیکنه,27.0,1
3808,همانند اکثر محصولات اندرویدی ایسوس، padfone نیز از رابط استاندارد اندروید ۴٫۰ استفاده می‌کند که کمی توسط ایسوس تغییر یافته است از آنجایی که padfone از پردازنده پردازشگر گرافیکی قوی‌تری نسبت به مدل پیشین استفاده می‌کند، محیط سیستم عامل روان‌تر سریع‌تر است.,44.0,3
1970,این دوربین از نظر کنترل‌ها هم کاملا غنی می‌باشد.,10.0,3
4652,در ضمن حالت واید بسیار عالی بزرگنمایی ۱۱x را نیز ارایه می‌کند.,14.0,4
538,netframework ۳٫۵ به صورت پیش‌فرض برروی ویندوز است که این مشکل نیز با اضافه کردن نسخه تا ۳.,18.0,2
6284,صفحه نمایشش معلومه که زیر آفتاب به درد نمیخوره,9.0,1
1023,سطوح به‌سازی ارائه شده توسط کیت تکامل هوشمند smart evolution به سال خرید آن بستگی دارد.,17.0,2
1291,پیشرفت بعدی ios در مورد برنامه siri است که با معرفی در iphone ۴s شگفتی همگان را برانگیخت حالا با بهبود آن، کاربرد‌های بیشتری نیز پیدا نموده است.,29.0,2
2032,به هر صورت به نظر می‌رسد برای مبتدیانی که به کار کردن با نمایشگرهای لمسی گوشی‌های تلفن همراه تبلت‌های خود عادت کرده‌اند، قرار دادن نمایشگر لمسی بر روی dslr سطح مبتدی فکر بدی نباشد.,36.0,3
3568,بدین ترتیب به آسانی می‌توانید عکس سوژه‌های بسیار کوچک را هم ثبت کنید.,14.0,3
5576,لولایی که نمایشگر را نگه می‌دارد کاملا مستحکم است دکمه‌ها نیز بازخورد خیلی خوبی دارند.,16.0,4
6509,درکل مجموعه سخت افزار نرم افزار ایفون در مقایسه با رقیبان مطابق انتظارات قبلی ظاهر نشده است.,17.0,1
445,xbox ۳۶۰ slim با ظرفیت‌های مختلفی به بازار عرضه شده است.,11.0,2
3169,بعلاوه از فن‌آوری لمسی خازنی بهره می‌برد.,8.0,3
6698,در پایان اینکه بر اساس این همه شایعات در مورد این گوشی بی صبرانه منتظرش بودم در فکر خریدنش بودم ولی حالا نه با توجه به قیمتی هم که خواهد داشت.,31.0,0
208,همچنین در کانفیگ هایی از مدل‌های چهار هسته‌ای سری پردازنده‌های amd نیز استفاده شده.,15.0,2
3145,این هم دقیقا به دلیل بهره گیری از لنزی کوچکتر می‌باشد.,12.0,3
2122,اما با وجود امکانات مختلف ارتباطی بر روی این تبلت مانند۴g، wi-fi، ۳g gprs، به راحتی با حداکثر سرعت می‌توان به مرورگری اینترنت پرداخت.,28.0,3
2371,فرمت نخست برای تماشا بر روی سینمای خانگی مناسب است فرمت دوم فرمت مناسب‌تری برای استفاده بر روی رایانه می‌باشد.,21.0,3
4836,واقعا گوشی خوبیه شک نکنید شگفت زده میشید اپدیت ۴٫۲ هم بزودی براش میاد همراه با سنس,17.0,4
3400,صدای اسپیکرش خوبه خروجی هندزفریش عالیه فقط باید برایش یک هندزفری استریو تهیه کنید چون هندزفری‌های خودش جالب نیستن یه مورد که تنظیمات اکولایزر فکر نکنم داشته باشه، من که پیدا نکردم.,34.0,3
1304,نکته‌ی جالب این است که به محض روشن کردن دوربین فلاش به بالا می‌پرد.,15.0,2
936,تا حالا تستش نکردم.,5.0,2
1824,جایگاه بیشتر کنترل‌ها دکمه‌ها نیز شبیه به دوربین ۵۵۰d می‌باشد اگر هم تغییری رخ داده بیشتر تزئینی بوده است.,20.0,2
653,به هر صورت همانطور که گفتیم، hx۲۰۰v تنها نسخه‌ای بهبود یافته از hx۱۰۰v می‌باشد که حتی از نظر ابعاد، وزن طراحی ظاهری نیز تفاوت چندانی با آن ندارد.,35.0,2
1647,فارسی هم نسخه گوشی من واسه تایپ اسمس داره منتها منوی فارسی نداره.,14.0,2
5853,ایزو ۸۰۰ مقدار بیشتری نویز، کاسته شدن از غلظت رنگ‌ها جزئیات را نشان می‌دهد.,16.0,1
5777,تازه اگر در هنگام اتصال به hdtv از طریق پورت hdmi به مود sleep بروید اول باید کابل hdmi را در بیاورید سپس آن حرکت را انجام دهید.,29.0,1
4381,همه چیزش عالیه!,4.0,4
2501,درسته منو فارسی نداره ولی حداقل میتونین مطمئن باشین که یه دوربین ساخت ژاپن خریدین نه ساخت چین.,19.0,3
3871,این نوع سنسورها که به سنسورهای hs هم معروف هستند در شرایط نوری ضعیف عملکرد بهتری را از خود نشان می‌دهند در ایزوهای بالاتر توانایی تولید عکس‌های با کیفیت‌تری را دارند.,32.0,3
2983,با این قیمت میشه یه galaxy ace خرید که هم پردازنده قویتری داره هم دوربینش فلاش داره,17.0,3
6065,مشکل گرفتن که آخر هم هارد رو بهم ندادن گفتن زنگ می‌زنن.,13.0,1
1806,به تعداد هسته‌ها نگاه نکنید دوستان!,7.0,2
6258,کیفیت اسکن عکس‌های رنگی هم خیلی خوب است ولی همچنان همان مشکل در رنگ خاکستری به چشم می‌خورد.,19.0,1
