,comment,length,label_id
6735,پلاستیکی بودن جنس بدنه کیفیت پایین صفحه نمایش برای من قابل چشم پوشی نیست هر قدر هم که ارزون باشه تاثیری در نظر من نداره,25.0,0
3500,برای مثال دو حالت عکاسی hdr burst shot به حالت‌های عکاسی اضافه شده‌اند.,14.0,3
690,به شما قول می‌دهیم go pro hero فقط یک دوربین نیست، این وسیله همه آنچه را که برای ثبت لحظات ماجراجویانه ورزشی به آن نیاز دارید فراهم می‌کند.,30.0,2
1431,دکمه کنترل صدا دکمه‌ی power هر کدام در طرفین گوشی قرار دارند.,13.0,2
3748,طول این گوشی ۱۰۳ عرض آن ۵۷ میلی‌متر می‌باشد که در کنار وزن ۹۹ گرمی گوشی‌های انحنا دار آن، tipo را به یک گوشی خوش دست تبدیل نموده است.,30.0,3
5165,ولی اگر میخواهید دوربینی بخرید که مدت‌ها از خرید دوربین بی نیاز بشید این دوربین رو توصیه می‌کنم.,19.0,4
5543,جنس بدنه این تبلت کوچک نیز همانند تبلت‌های ۹٫۷ اینچی ساخت اپل، تماما از آلومینیوم است همین موضوع باعث می‌گردد که در این زمینه اپل مجددا بسیار موفق عمل نماید.,32.0,4
4494,"کیفیت صفحه نمایش تو عمل واقعا راضی کنندست اصلا به چشم نمیاد نسبت به امکانات واقعا محشره من الان دو هفته‌ای میشه که دارمش به جرات میشه گفت از media pad fhd asus transformers مناسبتره، مخصوصا gamingش عالیه، shadowgun,blade slinger,real boxing..",45.0,4
4568,چینش دکمه‌ها کنترل‌های دوربین واقعا عالیست.,7.0,4
3699,میتونی روش حساب کنی تو عکاسی از نظر کیفیت خوبه فقط یه کم ابعاد عکس مربع مانند ۳۴۵۶×۴۶۰۸ که کل مانیتور رو نمیگیره بعدا خودت باید تنظیم کنی وزن سبکی هم داره باطریش اگه میشد مثل کانون بیرون از دوربین شارژ میشد خیلی خوب بود یه مقدار زومش کمه ولی میشه باهاش کنار اومد,56.0,3
1425,برخلاف مدل پیشین، padfone از کلیدهای نرم افزاری برای کنترل قسمت‌های مختلف سیستم عامل استفاده نکرده در پایین صفحه نمایش، سه کلید سخت افزاری لمسی خازنی وجود دارند.,31.0,2
1660,تکنولوژی چاپ در این دستگاه از نوع جوهرافشان بوده امکان چاپ رنگی ویژگی دیگر این پرینترهای چندکاره است.,19.0,2
937,بر روی این تبلت نصب شده‌اند امکان دریافت برنامه‌های دیگری نیز از طریق فروشگاه google play وجود دارد.,19.0,2
4009,تو این دو روز عاشقش شدم عالیه.,8.0,4
4186,فوق العاده‌ترین ۳d که تا الان ساخته شده,8.0,4
5353,gps داخلی ویژگی بسیار خوبی است که بر روی ft۳ وجود دارد.,13.0,4
3065,بد چیزی هم نیست,4.0,3
140,همین نیز باعث می‌شود که این پرینتر بیشتر مناسب استفاده‌های خانگی یا دفاتر کاری کوچک باشد.,17.0,2
5018,بهترین گوشی قبل از آیفون ۵..,6.0,4
5374,گیرنده دیجیتال فراسو مدل fdr-۲۱۱ با امکانات جدید، کیفیت ساخت فوق‌العاده استفاده از تکنولوژی‌های روز به بازار عرضه شده است.,22.0,4
1829,من ۶ماه این گوشیرو دارم تازگی به belle آپدیت کردم.,11.0,2
994,از لحاظ مقاومت وقتی شما به گوشی مثل siii یاone نگاه میکنید کل جلو گوشی را صفحه‌ای به ابعاد ۴٫۷ یا ۴٫۸ اینچ اشغال کرده همچنین با ضخامتی کمتر از سانت.,32.0,2
6812,به‌صرفه نیست تنوع رنگ هم نداره.,7.0,0
3263,با وجود این سخت افزار مناسب البته سیستم عامل روان ویندوز که همواره با مدیریت خوب بر حافظه رم، سرعت مناسبی را به کاربر ارائه نموده است، تمامی کارها در این تبلت با سرعتی بسیار خوب انجام خواهند شد.,40.0,3
2631,من ماهه ازش استفاده می‌کنم واقعا راضی هستم.,9.0,3
3228,با این میزان حافظه می‌توان تعداد مناسبی فایل نظیر عکس، موسیقی ویدیو را بر روی این گوشی ذخیره کرد.,21.0,3
6405,کیفیت فیلم برداری: عالی کیفیت عکس برداری: خیلی ضعیف (در حدی کمتر از دوربین‌های ۳٫۲ مگا پیکسلی) کارایی باتری: مثل اکثر مدلهای اکسپریا ضعیف ابعاد صفحه نمایش: به خاطر صفحه نمایش کوچک در نتیجه صفحه کلید کوچک باید کلا قید نوشتن پیامک به زبان فارسی را بزنید.,54.0,1
374,چرا که این مدل شباهت بسیاری با گوشی‌های خانواده لومیای نوکیا دارد که البته در بین گوشی‌های htc طرحی متفاوت با مدل‌های قبلی محسوب می‌گردد.,26.0,2
1866,در قسمت پشتی دوربین هم نمایشگر اینچی ۲۳۰۰۰۰ پیکسلی قرار گرفته که عمل کادر بندی سپس تماشای تصاویر گرفته شده را می‌توانید از طریق آن انجام دهید.,28.0,2
1863,سوما: تصویر فیلمبرداری شده در تمام شرایط تصویربرداری به اصطلاح عامی فریم فریم است همانند دوربین گوشیهای موبایل.,20.0,2
5602,در عین حال در زوم کامل توانای ارائه بزرگنمایی تا ۳۰ برابر را دارد که بسیار عالیست در سطح سوپرزوم‌ترین دوربین‌های دنیا قرار می‌گیرد.,25.0,4
1341,نظر دوستمان جناب منظری نزدیک به واقعیته,7.0,2
3616,سامسونگ به کمک سنسور شتاب سنج، بعضی کنترل‌های حرکتی جالب را برای این گوشی در نظر گرفته است.,19.0,3
2700,این تبلت امکانات فراوانی دارد که مطمئنا خریداران خود را نا امید نخواهد کرد.,14.0,3
3679,از نظر کارایی بنظر من بهترین گوشی هست که فعلا میشه استفاده کرد همچنین قیمتش بسیار مناسبه ولی فقط باتری ضعیفی داره,22.0,3
1790,طراحی ساخت طراحی macbook proی جدید (که retina macbook pro نیز نامیده می‌شود) را می‌توان تلفیقی از macbook air سری macbook pro سال گذشته دانست.,27.0,2
6589,شایان ذکر است دوربین فیلم‌برداری jvc مدل gz-hd۳ به لرزش‌گیر اپتیکال مجهز نیست.,14.0,1
4054,برنامه‌های تدوین عکس ویدئویی که سامسونگ بر روی این تبلت قرار داده است بسیار کامل است با محیط ساده‌ای که دارند، بسیار مناسب کاربران مبتدی هستند.,27.0,4
3339,اما تنها مشکلی که داره اینکه (پوشه android/data) در حافظه گوشی نصب میکنه نه در کارت حافظه از اونجایی که حافظه گوشی ۴گیگ از ۴گیگ حدود ۱٫۷ گیگ در دسترس داره اگه یک بازی hd که data بازی حدود ۱٫۵ گیگ باشه نمیشه در پوشه android کپی کرد.,51.0,3
1273,صفحه نمایشصفحه نمایش اینچی htc desire قادر است تصاویر را با رزولوشن ۴۸۰x۸۰۰ پیکسل به نمایش بگذارد.,20.0,2
6554,توصیه برای کساییکه مثل من بین این گوشی s۳ موندن؛ کیفیت تصویر این گوشی بسیار پایین تراز s۳ هستش، رابط کاربری s۳ هم خیلی بهتره.,28.0,1
995,برای مثال جلوه‌ی نخستین که به نام miniature effect بود در حقیقت عملکرد لنزهای tilt shift بر روی dslr‌ها را تقلید می‌کند که از این طریق می‌توانید دوستان خود را مانند آدمک‌های اسباب‌بازی خیلی کوچک در آورید.,38.0,2
1901,با این حال تصور ما این است که در هنگام استفاده از زوم ۳۰ برابر، به خصوص وقتی که به دلیل شرایط نوری یا هر چیز دیگر، سرعت شاتر پایین است، بهتر است که از سه پایه استفاده کنید.,43.0,2
1419,همچنین رم این گوشی نیز ۶۴ مگابایت است.,9.0,2
1363,از نظر امکانات جانبی نیز همانطور که گفتیم دوربینی سطح مبتدی می‌باشد.,13.0,2
4205,برای مثال مدل ۱۵٫۶ اینچی که از پردازنده core i۳ کارت گرافیک مجزای geforce gt ۵۲۰mx استفاده می‌کند، در تست مرورگری اینترنت از طریق wi-fi روشنایی صفحه متوسط، توانست بیش از ساعت شارژ دهی کند که میزان بسیار خوبیست.,44.0,4
4534,از نظر کیفیت عکس‌های گرفته شده باید گفت که، عکس‌هایی که با ft۳ گرفتیم کاملا شارپ هستند در بیشتر مناطق جزئیات خیلی خوب نمایش داده می‌شود.,27.0,4
1289,"بعضی از این مودها شامل مود عکاسی intelligent auto یا اتوماتیک هوشمند برای عکاسی تماما اتوماتیک، مودهای عکاسی p,a,s,m برای عکاسی خلاقانه حرفه‌ای مود عکاسی sweep panorama ۳d می‌شوند که باز هم توضیح بیشتری نمی‌دهیم تا شما را به نقد بررسی دوربین hx۱۰۰v ارجاع داده باشیم.",49.0,2
4285,کیفیت full hd فیلمبرداریش حرف نداره,6.0,4
3211,اگه قیمت خوبی داشته باشه جزو پرفروشترین‌ها میشه,8.0,3
978,اتفاقا باتریشم خوبه بنچمارک‌ها هم ببینید بد نیست,8.0,2
5284,تبلت خوبیه همون موقع که وارد بازار شد گرفتمش از نظر کیفیت تصویر عالیه full hd حرف نداره از نظر سخت افزاری هم خوبه مشکل ندارم در کل تبلت خوبیه.,31.0,4
6317,اما رنگ‌های خاکستری کمی تمایل به رنگ آبی دارند.,10.0,1
4427,در نهایت باید بگوییم که padfone یک محصول بی نظیر یک ترکیب عالی از سخت افزار نرم افزار است ایسوس بار دیگر ثابت کرد که یکی از بهترین تولیدکنندگان قطعات دیجیتالی در جهان می‌باشد.,35.0,4
2623,این گوشی از شبکه‌های ۳g ۲g پشتیبانی می‌کند همان‌طور که انتظار می‌رود از فن‌آوری‌ wi-fi نیز جهت اتصال به دنیای اینترنت بهره می‌برد.,24.0,3
4530,سلام دوستان این بهترین تبلت توی این رنج قیمت هست با امکانات عالیش مثل: پردازنده ۴هسته با فرکانس ۱٫۴ رم گیگ صفحه نمایش فول اچ دی دوربین قدرتمند با سنسور مگا قابلیت فیلم برداری فول اچ دی با ۳۰ فریم بر ثانیه واقعا ارزش خرید بسیار بالایی داره من که به زودی می‌خرمش,54.0,4
3794,اصلی‌ترین تغییر ایجاد شده در سیستم عامل ویندوز فون نسبت به نسخه‌های پیشین، منوی start است که قابلیت‌های شخصی سازی جدیدی به آن اضافه شده است.,27.0,3
3471,بخصوص اینکه u۳ هم ساپورت میکنه.,7.0,3
4024,همانند عکس‌های گرفته شده، کیفیت فیلم‌برداری این تبلت نیز بسیار خوب رضایت بخش است.,16.0,4
3776,این دوربین از مودهای عکاسی خوبی چون sr auto، auto program بهره می‌برد.,15.0,3
2819,اما بازم نسبت به قیمتش خوبه,6.0,3
3181,فروشش توی امریکا با قیمت واقعا مناسب شروع شده!,10.0,3
3686,اما برخلاف مدل sx۳۰ is که فقط می‌توانست با کیفیت hd فیلم‌برداری کند، به مدد سنسور hs دوربین sx۴۰ hs فیلم‌برداری full hd نیز میسر شده است.,30.0,3
4345,از لحاظ سرعت بی نظیر از لحاظ کارایی بهترین می‌باشد.,11.0,4
3348,عاشق پیشنهاد‌های ویژه هستم ممنون,5.0,3
641,با این دوربین امکان عکاسی در حالت‌های مختلف عکاسی در شرایط نوری ضعیف را خواهید داشت.,16.0,2
5237,بیشتر قسمت‌های بدنه‌ی آن هم از مواد قابل بازیافت بسیار عالی ساخته شده‌اند.,14.0,4
5321,کیفیت عکاسی در شب نیز همانند دوربین‌های dslr عالیست به طوری که می‌توانید نوردهی به مدت ۳۰ ثانیه یا حتی حالت bulb برای نوردهی نامحدود را نیز انتخاب کنید.,30.0,4
5746,به خصوص اینکه؛ از نمایشگرهای led با کیفیت بسیار بالا بهره می‌برند.,14.0,4
2427,به هر حال درست است که نوکیا در چند سال اخیر عرصه را در بسیاری از موارد به کمپانی‌های دیگر باخته است، ولی هنوز در زمینه طراحی جزو پیشتازان سردمداران صنعت گوشی محسوب می‌گردد.,35.0,3
729,عکس‌ها فیلم‌ها بر روی کارت حافظه‌ی sd/sdhc/sdxc ذخیره می‌گردند باتری لیتیوم-یونی دوربین نیز در هر بار شارژ کامل توانایی پشتیبانی برای گرفتن تا ۳۴۰ عکس را دارد.,28.0,2
2630,ال جی قدرت خودشو ثابت کرد با تولید گوشی جدید با نام‌های optimus nexus میتونه گوی سبقت رو از سامسونگ بگیره.,22.0,3
5167,به همین دلیل نیز گستره‌ی حساسیت سنسور این دوربین از ۱۰۰ تا ۳۲۰۰ می‌باشد که بسیار خوب است.,19.0,4
5428,به همین دلیل همچنان بسیار خوش دست است به راحتی در دست در جیب جای می‌گیرد.,17.0,4
6696,تجربه کاری من با ویندوز ۷٫۵ میگه که یک سیستم عامل کند خسته کننده با محیط کاربری یکنواخت تعداد محدود نرم افزار ارائه شده هست هرچند شرکت مایکروسافت ویندوز هشت رو رقیب آی ا اس اپل گوگل اندروید دونسته اما باید به انتظار نشست دید ایا این چنین هست یا,50.0,0
3075,در این گوشی مشکل باتری وجود نداره چون علاوه بر اینکه فوق کم مصرف هست قابلیت تعویض باتری توسط کاربر رو هم داره!,24.0,3
1797,تست پرینت صفحه‌ای ما ۲۷ ثانیه به طول انجامید که برابر با چیزی در حدود ۱۱٫۱ صفحه در دقیقه است.,22.0,2
4042,مدیریت بر دو سیم کارت در نسخه دو سیم کارته این گوشی نیز به خوبی صورت می‌پذیرد که امکانات بسیار خوبی را به کاربر می‌دهد.,26.0,4
4278,تاچ پد طراحی فوق‌العاده خوبی دارد.,7.0,4
5811,مشکل اینه که وقتی هارد رو وصل می‌کنم تا بیپ می‌کنه مدام چشمک می‌زنه ولی وصل نمی‌شه (این طور که از سرچ کردن فهمیدم مشکل ضعیف بودن سیمکشی داخلی دارن که خیلی جدی نیست سریع درست می‌شه) زنگ زدم به سازگار، اول گفتن مشکلی نیست سریع حل می‌شه اما وقتی بردمش برای تعمیر نه تنها هزینه‌ای برای بررسی (!,63.0,1
6711,ولی ایزو ۳۲۰۰ کاملا نویزی است.,7.0,0
1862,ولی قبل این یه گلکسی نوت داشتم که کلا نظرمو نسبت به سامسونگ عوض کرد.,16.0,2
5570,این یک رکورد شگفت انگیز است.,7.0,4
3401,واقعا همیشه کارم رو راه انداخته به شدت ازش راضی هستم.,12.0,3
5907,متاسفانه این صفحه نمایش کاملا براق بوده در ضمن روشنایی آن نیز کم است.,15.0,1
5046,من هفته پیش از دیجی خریدم به نظرم عالیه,9.0,4
5277,سبک ابعاد خیلی عالی سرعت بالا,6.0,4
1215,به هر حال دکمه‌های حرارتی علت این مشکله که نباید در چنین گوشی فشرده از آن استفاده می‌شد اگر مانند سایر برند‌ها دکمه‌ها پایین‌تر قرار می‌گرفت مشکلی به وجود نمی‌آمد الان هم با کالیبره کردن (پایین آوردن حسایت با افزایش دمای گوشی) مشکلی وجود نخواهد داشت.,48.0,2
742,سمت راست تاچ پد، نوار مخصوص اسکرول وجود دارد که توسط دانه‌های رنگی مشخص شده است.,17.0,2
4227,برای اونایی که گوشی‌های بزرگ رو دوست دارن، بهترین گوشیه!,12.0,4
1788,به علاوه این تبلت می‌تواند با کیفیت full hd ۱۰۸۰p فیلم‌برداری کند.,14.0,2
5056,برنامه دیگری که به ios اضافه شده برنامه passbook نام دارد که یک برنامه organizer بسیار قوی با امکانات بسیار خوب است که تمامی فعالیت‌های شما را می‌تواند ذخیره، برنامه ریزی یاد آوری نماید.,36.0,4
5401,در ضمن در نظر داشته باشید که ipod touch برای مرور اینترنت (wifi) وایمیل بسیار عالی ست.,19.0,4
3948,بدون هیچ مشکلی کار میکنه.,6.0,4
5014,همه چیز بسیار روان بوده کوچک‌ترین کاهش سرعتی در حین کار کردن با گوشی احساس نخواهید کرد.,17.0,4
6720,امیر من در این گوشی فقط این عیب هارو دیدم که تقریبا همه جا بهش اشاره شده من تحقیق کردم فهمیدم که با پنس‌های مخصوص میشه نانو سیم کارت درست کرد (با سیم کارت معمولی) من می‌خواهم xperia بخرم، چیزی که ایفون نداره ولی داره مثل ip۵۷ (ضد آب) ۴g (نسل باند‌های ارتباطی که بعضی جاها نوشته ایفون هم ۴gداره) وnfc.,70.0,0
4251,همانند داک مدل پیشین، بلندگوی داک padfone نیز صدایی بسیار شفاف قدرتمند تولید می‌کند تنها کافیست که گوشی را در شکاف داک قرار داده از گوش کردن به موسیقی یا تماشای فیلم لذت ببرید.,36.0,4
3291,باتری با قرار گرفتن یک باتری ۲۱۰۰ میلی آمپری، شارژ دهی این گوشی نسبت به مدل پیشین آن، که از یک باتری ۱۸۰۰ میلی آمپری استفاده می‌نمود، تا چند ساعت بهتر شده است.,36.0,3
2336,عکس‌های گرفته شده توسط دوربین canon powershot sx۲۳۰ hs کیفیتی خیلی خوبی دارند.,15.0,3
4034,این پردازنده همان مدلیست که در گوشی galaxy nexus نیز استفاده شده است پردازنده فوق العاده قدرتمندیست.,17.0,4
4852,نسبت به سامسونگهای همرده یه سر گردن بالاتره وای فای خیلی قوی داره.,14.0,4
6408,مورد دیگری که در d۶۰۰ هم وجود دارد به آن اشاره کردیم، بیشینه سرعت شاتر این دو دوربین است که تا ۱/۴۰۰۰ ثانیه بیشتر نیست.,28.0,1
6226,اسکنر canon lide ۱۰۰ توانایی اسکن کردن نگاتیو ۳۵mm را ندارد.,13.0,1
6265,htc +x معایب ذیل را دارد ۱- عدم امکان استفاده ار مموری کارت ۲- عدم پشتیبانی از کابل otg ۳.,20.0,1
2982,در کنار اینها می‌تواند از لنزهای سونی لنزهای کارل زایس هم بهره ببرد.,14.0,3
6728,از نظر من ارزشش رو نداره.,7.0,0
2159,در قسمت پشت دوربین هم جایی برای قرار گرفتن انگشت شست قرار دارد چینش دکمه‌ها کنترل‌ها نیز عالیست.,19.0,3
5855,با سلام در حد انتظار پیش بینی ظاهر نشد.,10.0,1
5982,لنزش هم زود لک وخش می‌افته,6.0,1
6786,دوربین یکی از بزرگ‌ترین ضعف‌های نسل چهارم ipod touch، دوربین آن بود که دقت آن کمتر از یک مگاپیکسل است.,22.0,0
4245,با سلام به همه اولش می‌خواستم از همه دیجیکالایی‌ها به خاطر سایت خدماته عالیشون تشکر کنم,16.0,4
1073,چیزی که اینجا بهش اشاره نشده زد اب بودن این گوشیه,11.0,2
211,بر روی لبه سمت چپ دستگاه، جک ۳٫۵ میلی متری هدفون در آخر بر روی ضلع چهارم یا بالایی دستگاه نیز شکاف قرار گیری کارت حافظه به همراه سیم کارت در مدل‌های سیم کارت خور که البته توسط درپوشی محفوظ گردیده قرار گرفته است.,45.0,2
5550,من همه چیزش چک کردم خیلی خوبه گرافیکشم خوبه بازی‌ها رو راحت روان میاره,14.0,4
6488,این گوشی زوم ۱۶ برابر نداره، اصلا زوم نداره برخلاف چیزی که تصور میشه کیفیت عکسش مثل دوربین‌های سطح پایین نوکیا هست.,24.0,1
1878,این گوشی مجهز به نمایشگر ۳٫۷ اینچی لمسی capacitive می‌باشد.,11.0,2
3993,این دوربین مجهز به سنسور تصویر bsi cmos می‌باشد که به خصوص برای عکاسی در شرایط نوری ضعیف انتظار می‌رود که عملکرد خیلی بهتری را از خود به نمایش بگذارد.,31.0,4
1886,امروز به دستم رسیده دارم تست می‌کنم.,8.0,2
3937,همان‌طور که انتظار داشتیم، مرورگری اینترنت با galaxy tab ۱۰٫۱ بسیار لذت بخش است.,17.0,4
1074,این گوشی در حقیقت برادر کوچک xperia arc محسوب می‌شود.,11.0,2
2568,با اینکه صفحه نمایش note در مقایسه با بسیاری از رقبایش خیلی فوق‌العاده نیست حتی از note ۱۰٫۱ نیز ضعیف‌تر است، اما در کل عملکرد آن بسیار خوب مناسب است که رضایت کاربر را جلب می‌نماید.,39.0,3
6256,این به دلیل عدم توانایی پرینتر در چاپ خوب سایه‌ها بود.,12.0,1
5035,من دارمش بینظیره تو خریدش شک نکنید,7.0,4
2440,با محتواها قابلیت‌های بهبود یافته تجربه مشاهده هوشمندانه‌تری داشته باشید با سه سرویس انحصاری جدید سامسونگ برنامه‌های کاربردی برای سرگرمی کودکان kids، برنامه‌های کاربردی برای تندرستی fitness برنامه‌های کاربردی برای خانواده family story وارد دنیای سرگرمی‌های آنلاین شده از محتواهای ارتقا یافته جدید آنها بهره‌مند شوید.,47.0,3
282,لازم به ذکر است که گیرنده agps این تبلت، قابلیت دریافت امواج ماهواره‌های glonass را نیز دارد.,19.0,2
6092,نواقص: باتری بیشتر از یه روز دوام نمیاره.,10.0,1
739,نظر نهایی بعد از خرید,5.0,2
1349,"فرمت‌های صوتی قابل پخش این گوشی mp۳, aac, wav, wma فرمت‌های تصویری قابل پخش نیز mp۴, wmv, h.۲۶۳, h.",23.0,2
411,من بین این گوشی‌های سونی هم قیمت این شک داشتم که اینو گرفتم.,14.0,2
3751,مشخصاتش نسبت به قیمتش عالیه کیفیت ساخت بالایی هم داره.,11.0,3
6302,شاید تنها نقطه ضعف بدنه را بتوان براق بودن سطح خارجی آن دانست که بسیار مستعد جذب اثر انگشت است ترجیح می‌دادیم که acer بدنه خارجی دستگاه را به یک روکش مات مجهز می‌کرد.,35.0,1
