,comment,length,label_id
5730,در انتها، باید اذعان کنیم که با وجود مشکلات در برنامه maps یا کاستی‌هایی که در ios وجود دارد که شاید در اندروید وجود نداشته باشد، هنوز این سیستم عامل سریع‌ترین روان‌ترین سیستم عامل موجود بر روی تلفن‌های همراه تبلت‌ها به شمار می‌رود که به کاربر راحتی آرامش فوق‌العاده‌ای را اعطا می‌نماید.,54.0,4
634,از جمله قابلیت‌های ارتباطی htc desire sv می‌توان به پشتیبانی از wi-fi، gprs، ۳g اشاره کرد که برقراری ارتباط با اینترنت را به سهولت فراهم می‌کنند.,29.0,2
6496,فقط مشکلی که من دیدم کمی wifi نامناسب سرعت کمی داشت.,12.0,1
6660,البته برای نمایشگرهای در این سایز از رزولوشن wvga هم استفاده می‌شود ولی به احتمال زیاد به دلیل پردازشگر گرافیکی نسبتا ضعیفی که این گوشی داشته، سونی تصمیم گرفته که از رزولوشن بالاتر بهره نبرد.,37.0,1
4059,اول باید از دیجی کالا به خاطر ارسال بسیار سریع با کیفیت تشکر کنم، بسته بندی کالا نشان شبنم هم که روش بود خیالمو در مورد کیفیتش راحت کرد دوربین بسیار خوبیه، تنظیمات مختلف زیادی داره، برای شرایط مختلف هم تنظیم متفاوتی داره، بسیار خوشدست خوشگله، حس عکاس حرفه‌ای بودن رو میده!,58.0,4
1313,من به چند دلیل این گوشی رو خریدم,8.0,2
2606,از دیگر تفاوت‌های این دوربین با مدل پیشین می‌توان به توانایی پشتیبانی p۷۷۰۰ از فیلترهای پیچی ۴۰٫۵ میلی متری، توانایی عکاسی ۱۰۸۰p full hd نسبت به ۷۲۰p hd، توانایی کنترل فلاش‌های وایرلس اکسترنال سازگاری با یونیت‌های جی پی اس gp-۱ اشاره کرد.,49.0,3
519,در کل در طراحی مدل جدید سامسونگ، شباهت‌های بسیاری را با دیگر تبلت‌های ساخت این کمپانی مشاهده می‌نماییم.,20.0,2
535,چشمی اپتیکال این دوربین دقیقا همانی می‌باشد که بر روی دیگر دوربین‌های rebel به کار رفته تا نه از سایز نه از میدان دیدش کاسته شود.,26.0,2
2308,نمایشگر لمسی hs۹۰۰ اکنون کاملا بزرگتر، پاسخگو‌تر، روان‌تر شفاف‌تر است.,14.0,3
5870,جعبه‌ی این گوشی را که باز می‌کنید با تجهیزات خیلی ساده‌ای مواجه می‌شوید.,14.0,1
6281,مدتیه که این دوربین رو از دیجی کالا خریداری کردم لازم دونستم چندتا نکته رو به اطلاع کسانی که قصد خرید این مدل رو دارند برسونم اول از هرچیزی توجه داشته باشین که صفحه لمسی این دوربین مقاومتیه کابل hdmi نداره باید جداگانه تهیه بشه با توجه به ژاپنی بودن دوربین منوی شروع به زبان ژاپنیه تمام محتویات دفترچه راهنمای دوربین به زبان ژاپنی نوشته شده!,67.0,1
369,این یعنی اینکه در حالت زوم محور می‌توانید سه ماه کامل را جای دهید.,15.0,2
3502,شاید تنها نقطه ضعف فیلم‌برداری این گوشی، سیستم فوکوس ممتد آن باشد که کمی با تاخیر عمل می‌کند ولی در مجموع می‌توانیم بگوییم که در مقایسه با دوربین گوشی‌های رده بالای دیگر، دوربین xperia بسیار خوب رضایت بخش عمل می‌کند.,43.0,3
5614,تو همه تست‌ها سامسونگ نوت فوق العاده عمل کرد.,10.0,4
2593,سلام باتری گوشی من خیلی زود شارژ خالی میکنه فقط از باتریش رضایت ندارم در ضمن روی باتری ۱۱۶۰میلی آمپر نوشته شده کیفیت دوربینش خوبه رضایت بخشه کوچیک وخوش دسته نرم افزار ضبط صدا که نصب میکنی مشکلش حل میشه,41.0,3
3582,پس اگر شما هم به دنبال یک تلفن همراه دو سیم کارته جمع جور هوشمند هستید، htc desire را نیز جزو گزینه‌های خود قرار دهید.,27.0,3
2596,یکی از خصوصیات گوشی که ذکر نشده اینه که آندرویدش قابل آپدیت به ۴٫۱ است.,16.0,3
1278,با استفاده از فن آوری dual record نیز می‌توانید در هنگام فیلم برداری به عکاسی نیز بپردازید.,18.0,2
5414,این دوربین مجهز به نمایشگر اینچی ۴۶۱۰۰۰ نقطه‌ای است که سایز کیفیت خیلی مناسبی دارد.,16.0,4
2498,یکی از ویژگی‌های جالب این دوربین، بیشینه‌ی سرعت شاتر تا ۱/۴۰۰۰ ثانیه آن است که در حد دوربین‌های dslr می‌باشد عالیست.,23.0,3
1930,این در حالیست که عکاسی آن می‌تواند با رزولوشن ۱۱ مگاپیکسلی صورت گیرد عکاسی پیاپی با سرعت ۱۰ فریم بر ثانیه هم مقدور است.,25.0,2
5213,من چند ماه این گوشی رو دارم واقعا حرف نداره.,11.0,4
2753,من در حدود دو ساله که پیگیر مدل‌های مختلف گوشی هستم ولی گوشی تو این رنج قیمت رو دست این ندیدم.,22.0,3
6307,صورت می‌گیره موجب آسیب رسیدن به گوشی می‌شه.,9.0,1
2525,با این حال باید گفت که رقیب مستقیم این دوربین یعنی nikon d۶۰۰ از نظر مشخصات فنی چند نکته برتر دارد که از مهم‌ترین آن‌ها می‌توان به چشمی اپتیکال با توانایی پوشش ۱۰۰ درصد میدان دید سیستم فوکوس خودکار ۳۹ نقطه‌ای اشاره کرد.,45.0,3
5075,بسیار خوب، پس فهمیدیم که نسخه black با فاصله خیلی زیاد بهترین است.,15.0,4
3911,در کل می‌توانیم به طور خلاصه بگوییم که از کیبورد تاچ پد e۱-۵۳۱ کاملا راضی بودیم.,18.0,4
351,هر گاه که نمایشگر را باز می‌کنید دوربین روشن وقتی آن را می‌بندید خاموش می‌گردد.,16.0,2
6625,از ماه کارکردی که با این گوشی داشتم تنها ایرادی که تونستم ازش بگیرم تنها اندازه کوچک صدای نسبتا پایین اون بوده.,23.0,1
2886,مدل جدید سامسونگ که باز هم از خانواده galaxy می‌باشد گلکسی اس مینی نام دارد، مشخصاتی شبیه به galaxy طراحی شبیه به galaxy iii دارد تا گوشی دلخواه کسانی باشد که ابعاد بزرگ galaxy iii را نمی‌پسندند می‌خواهند با هزینه‌ای کمتر، یک گلکسی اس جمع جور‌تر داشته باشند.,50.0,3
2759,بالاخره گوشی مورد پسندم رو پیدا کردم.,8.0,3
640,من برای اولین بار دارم از سایت دیجی کالا خرید می‌کنم بدون اینکه بخوام برم تو بازار بگردم این گوشی رو انتخاب کردم فقط با توجه به مطالبی که شما دوستان نوشته بودید خود دیجی کالا در مورد این گوشی نوشته بود حتما حتما بعد استفاده از این گوشی میام در مورد نقاط ضعف قوتش می‌نویسم,54.0,2
1843,رنگ آن نیز مشکی از نوع مات است.,9.0,2
5242,هم نمایشگر ابعاد بزرگ خوبی دارد هم اینکه رزولوشن آن فوق العاده است.,14.0,4
2818,مهمتر از همه (((یه دفترچه یادداشت به تمام معنا))) به این میگن یه تبلت حسابی.,22.0,3
6034,روی کاغذ امکانات خوبی داره اما از نظر طراحی خیلی ضعیف عمل کرده.,14.0,1
3019,این گوشی ضد ابه,4.0,3
1624,در مورد آیپد مینی هم همین گونه است.,9.0,2
2880,برای مثال مدل x۵۳sv که دارای صفحه نمایش ۱۵٫۶ اینچی بوده از پردازنده‌ی دو هسته‌ای intel core i۵ کارت گرافیک nvidia geforce gt ۵۴۰m بهره می‌برد، در تست مرورگری اینترنت از طریق wi-fi با روشنایی متوسط صفحه نمایش، توانست بیش از ساعت ۱۵ دقیقه شارژدهی کند که میزان نسبتا خوبیست.,57.0,3
6570,. با خرید تا بازی vita میتونی یه دستگاه دیگه بخری,11.0,1
2168,اما من بهتون اطمینان میدم که اون مشکلش حل شدنیه اصلا نگران نباشید.,14.0,3
2531,من این تلویزیون رو از دیجی کالا خریدم اول از دیجی کالا قیمت کردم رفتم بازار دیدم بازار گرونتره اومدم از دیجی خریدم تازه حملش هم رایگان بود به نظرم صفحش کوچیکتر از اون چیزی که تصور می‌کردم بود یه ضعف هم داره اینه که وقتی تلویزیون رو مثلا با کانال خاموش کردی دفعه بعد برای روشن شدن کانال یک کنترل رو فشار میدی باز هم همون کانال رو میاره کیفیت صداش هم عالی بود بقیه چیز هاش رو هنوز تست نکردم امیدوارم چیز خوبی از آب در بیاد,89.0,3
4891,منوها خیلی استاندارد می‌باشند پیش از این شبیه به آن را بر روی دوربین‌های فیلم برداری پیشین کانن هم دیده بودیم.,21.0,4
5049,این لنز واقعا می‌تواند مثل یک تلسکوپ عمل کند تا سوژه‌های کاملا دوردست را بتوانید ثبت کنید.,18.0,4
4736,۱۱۲ گرم برای یک گوشی در این سطح فوق‌العاده است.,11.0,4
590,نرم افزارhtc بر روی این گوشی از نسخه آخر سیستم عامل اندروید یعنی نسخه ۴٫۱ یا jellybean استفاده نموده است.,20.0,2
1867,دکمه‌ی display به بالای دوربین کنار دکمه‌ی iso منتقل شده است تا در پشت دوربین جا را برای دکمه‌ی جدید info باز کند.,23.0,2
3994,البته صدای بیس بسیار کم نامحسوس بود ولی با این وجود، علاقه‌مندان به گوش کردن به موسیقی تماشای ویدیو، از بلندگوی fonepad کاملا راضی خواهند بود.,28.0,4
3790,فک کنم اپل دیگه به پای سامسونگ نرسه,8.0,3
2788,ولی از این گوشی کیفیت دوربینش به مراتب بالاتر روون تره.,12.0,3
2127,دوربین‌هایی با اشکال، ابعاد توانایی‌های مختلف که همگی برای یک هدف، آن هم عکاسی هرچه آسان‌تر سریع‌تر ساخته شده‌اند.,22.0,3
3812,بهترین گوشی نوکیا سری آشا,5.0,3
3391,صفحه نمایشصفحه نمایش موجود بر روی این گوشی یک صفحه نمایش اینچی لمسی خازنی از نوع tft می‌باشد.,19.0,3
2398,بنابراین از دست دادن فقط درصد میدان دید ارزش کاهش چشمگیر قیمت را داشته است.,15.0,3
2082,اومدم اینجا از گوشی لایو که تک سیم بود خوشم اومد تمام خصوصیاتش رو خوندم خریدم.,17.0,3
6545,در حالت عادی، دمای تمام قسمت‌های بدنه نوت‌بوک، بسیار پایین است اما هنگامی که دستگاه در حال انجام محاسبات سنگین باشد، دمای بعضی از قسمت‌ها مانند سمت چپ کیبورد، بسیار گرم می‌شود ممکن است در دراز مدت کمی آزاردهنده باشد.,45.0,1
6,فراموش کنید که هر سه مدل helmet، motorsports، surf دارای دوربین هایی با مشخصات یکسان می‌باشد تنها تفاوت آنها در متعلقات تجهیزات تکمیلی اتصال موجود در جعبه می‌باشد.,31.0,2
2335,سامسونگ همچنین برنامه‌های زیادی را به صورت پیش فرض بر روی تبلت خود قرار داده است، برنامه‌هایی مانند note planner شبکه‌های اجتماعی، شبکه‌های موزیک آفیس ویدیوپلیر all share..,31.0,3
3543,البته مادامی که استفاده نکرده باشین نمیتونین نظر بدین,9.0,3
1673,دوربین و..,4.0,2
4202,این نمایشگر که تراکم پیکسل ۳۳۶ppi را ارایه می‌کند همچنان برای تماشا کردن واقعا لذت بخش است.,19.0,4
5150,تصاویر فیلم برداری در روز به حدی با کیفیت هستند، که وقتی آن‌ها را بر روی hdtv بزرگ مشاهده می‌کنید گویی واقعی به نظر می‌رسند می‌توانید آن‌ها را لمس کنید.,32.0,4
3588,البته مانند سایر گوشی‌های ۳٫۳ اینچی، تایپ کردن با این گوشی به خصوص در حالت عمودی نیاز به کمی تمرین دارد ولی هنگامی که گوشی را به حالت افقی می‌برید، تایپ کردن بسیار راحت لذت بخش می‌شود.,40.0,3
5006,این پردازشگر به قدری قدرتمند است که هیچ‌گونه کاهش سرعتی حتی هنگام اجرای بازی‌های سه بعدی یا انجام پردازش‌های سنگین، مشاهده نخواهید کرد.,24.0,4
1346,عکسبرداری این گوشی رو با گوشی سابق خودم ۶۲۲۰ classic که مقایسه کردم.,14.0,2
1714,ضمنا من این دوربین را از این سایت تهیه کرده‌ام.,11.0,2
1807,همانطور که گفتیم، r۳۰ جزو دوربین‌های سری سطح مبتدی کانن به حساب می‌آید.,16.0,2
6746,شارژ باتری نیز می‌توان گفت که خیلی زود تمام می‌شود پس از حدود یک ساعت فیلم برداری کاملا تخلیه می‌گردد.,21.0,0
4660,کیفیت مکالمه بسیار عالی.,5.0,4
3986,روز‌های اول اهمیتش رو نمیدونستم واقعا گوشی تک ایه مشکلی نداره برای خرید فوق العاده است,16.0,4
1737,البته پیشنهاد میدم صبر کنین.,6.0,2
6487,البته این زوم بدون سه پایه یه چیز به درد نخور میشه.,13.0,1
4479,با الگوریتم پیچیده برتر تنظیم دقیق نور که کنتراست، رنگ وضوح را بهبود می‌بخشد، کیفیت تصاویر پیش چشم خود را باور نخواهید کرد.,25.0,4
2506,همانطور که گفتیم کیفیت دید از زاویه‌ی آن فوق‌العاده است با چرخاندن نگاه کردن از زوایای تندتر هم کیفیت رنگ‌ها تغییر نمی‌کند.,23.0,3
643,این موضوع تنها نگرانی موجود بر روی این گوشی است.,11.0,2
3506,اگر به دنبال فیلم برداری با سرعت بالاتری هستید می‌توانید رزولوشن ۷۲۰p hd را هم انتخاب کنید که بدین ترتیب عمل ضبط ویدیویی با سرعت ۶۰ فریم بر ثانیه انجام می‌شود تا جزئیات در حرکت‌های سریع؛ خیلی دقیق‌تر ثبت بشوند.,43.0,3
2150,سرعت بالا دقتش آدمو تشویق میکنه که از ترک دیوار تا چهره تک تک فامیل باهاش عکس بگیره,18.0,3
6314,فیلم‌ها نیز دیگر hd نیستند.,6.0,1
3353,این صفحه نمایش تصاویر را با رزولوشن ۳۲۰×۴۸۰ پیکسل نمایش می‌دهد تراکم پیکسلی بسیار خوب ۱۶۵ppi را تولید می‌نماید.,23.0,3
3997,من ماه هست ایکس پریا پرو دارم خیلی راضی هستم.,11.0,4
50,در لبه سمت راست آن دکمه پاور همچنین کلیدهای کنترل صدا قرار دارند در لبه پایینی آن نیز پورت micro usb خروجی هدفون ۳٫۵ میلی متری تعبیه شده‌اند.,29.0,2
1592,نکته نگران کننده در مورد xperia مشکل مرگ ناگهانی در بعضی از آنهاست که این مشکل با ارائه به روز رسانی توسط شرکت سونی قابل حله.,27.0,2
3269,به نظر دوربین ۶۵۰d به جهت کارآیی در عکاسی با دوربین ۶۰۰d تفات خاصی ندارد فقط مزیت‌ها در مود فیلمبرداری است پیشنهاد می‌کنم اگر علاقه به فیلمبرداری‌های پورتابل دارید نمی‌خواهید هزینه هایی سنگین برای خرید دوربین‌های مثل ۵d بدهید این دوربین می‌تواند برای شما جذاب باشد,48.0,3
883,پدفون هم همین قیمت بود!,6.0,2
3128,۲- این گوشی به دلیل سهولت کار، صفحه کلید بزرگ جدا، کیفیت خوب صفحه نمایش، مناسب افراد بالای ۵۰ سال سن است.,26.0,3
1491,از لحاظ ظاهری می‌توان گفت که گوشی padfone مدل بزرگ‌تر شده گوشی padfone است.,15.0,2
4923,این ویژگی می‌تواند برای بسیاری وظایف به کار آید مانند ارسال پیام متنی، پیدا کردن یک محل مانند یک رستوران یا هر محل دیگری، تنظیم ساعت تنظیم زمان زنگ زدن ساعت یا هر وظیفه‌ی دیگری که بخواهید.,40.0,4
6209,هرچند که ممکن است هزینه‌ی نگهداری کارتریج آن کمی بیشتر از رقبا باشد.,14.0,1
5363,آسان کلیدهای کامل بر روی دستگاه، کنترل باریک با برد مناسب، منوی آسان فارسی,16.0,4
949,تراکم پیکسلی این صفحه نمایش برابر با ۲۱۷ پیکسل در هر اینچ است از حرکات مالتی تاچ نیز پشتیبانی می‌کند.,21.0,2
224,در ضمن حافظه داخلی ۹۶ گیگابایتی را هم باید به آن اضافه کنید.,14.0,2
5694,توانایی زوم بالای ۳۰ برابر هم ویژگی خیلی خوبی برای علاقه مندان به این ویژگی می‌باشد، در ضمن لنز آن‌ها در حالت واید فاصله‌ی کانونی معادل ۳۰ میلی متر دارد که برای دوربین هایی در این کلاس عالیست.,40.0,4
4261,رنگ‌های تولید شده نیز بسیار زنده طبیعی هستند.,9.0,4
2826,"همانند مدل‌های پیشینش در قسمت بالای دوربین پیچ تنظیم مودهای عکاسی قرار گرفته که از آن طریق می‌توانید مودهایی چون اتوماتیک هوشمند یا مودهای خلاقانه‌تر p,a,s,m را انتخاب کنید.",30.0,3
2988,این برای دیدن سوژه هایی که ممکن است به کادر شما وارد شوند خوب است.,16.0,3
2247,مشخصات سخت افزاری مناسب در کنار سیستم عامل ویندوز ۸، این گوشی را به یک گوشی مناسب برای طرفداران گوشی‌های ویندوزی تبدیل نموده است.,25.0,3
109,برای مثال تمام قابلیتهای این تلویزیون رو میشه با گوشیتون کنترل کنید.,13.0,2
6702,صدای خودتونو می‌شنوید وقتی صحبت می‌کنید که بسیار آزاردهنده است!,11.0,0
720,برای اینکه تفاوت p۵۰۰ sx۴۰ رو درک کنید کافیه با هر دو دوربین از سطح ماه عکس بگیرید,20.0,2
4541,پخش کننده ویدئوی گوشی نیز بسیار مناسب است.,9.0,4
5884,تنها ایرادی که من میتونم بهش بگیرم وزنشه که حدود ۶۰۰ گرمه کمی دست رو خسته میکنه.,18.0,1
6200,در مورد پروژکتور هم باید گفت که عملکرد آن شبیه به pj۷۶۰v است پیشرفت چندانی نسبت به مدل پیشین نداشته.,23.0,1
1033,طراحی این گوشی شبیه به بسیاری از گوشی‌های هوشمند موجود در بازار می‌باشد.,14.0,2
3645,در نهایت اگر به دنبال کامل‌ترین بهترین مالتی مدیا پلیر همراه موجود در بازار هستید، ipod touch نسل پنجم، تنها انتخاب شما خواهد بود!,26.0,3
3232,به نسبت قیمت کارایی بسیار بالا ظاهر بسیار مناسبی داره.,11.0,3
4136,این قلم علاوه بر کارایی اصلی خود در حین کار با تبلت، یک کارایی شگفت انگیز دیگر نیز دارد.,21.0,4
1328,در گوشه سمت چپ بالای صفحه نمایش یک آیکون گوگل مشاهده می‌نمایید که در واقع یک میانبر برای دسترسی سریع به سایت گوگل می‌باشد.,25.0,2
4133,در این حالت کمینه‌ی نسبت کانونی نیز f/۳٫۱ است که برای عکاسی در شرایط نوری ضعیف‌تر بسیار خوب است.,20.0,4
5675,با استفاده از pictbridge می‌توانید دوربین را به رایانه متصل کنید با سرعت بسیار زیادی به انتقال عکس‌ها فیلم هایی که گرفته‌اید بپردازید.,24.0,4
4410,مخصوصا برنامه‌ای که روی خودش داره عالیه.,8.0,4
1591,سخت افزار داخلی باتری هدف کاربری این نوت‌بوک دقیقا کارهای ساده اداری یا خانگی می‌باشد.,16.0,2
2936,این در حالی است که این کارت گرافیکی از فن‌آوری nvidia optimus نیز بهره می‌برد.,16.0,3
2548,با توجه به سخت افزار مناسب امکانات مختلف ارتباطی این گوشی به همراه مرورگر این گوشی، می‌توانید به راحتی به مرور در دنیای اینترنت بپردازید.,27.0,3
1709,البته سامسونگ دلیل این کار را وجود صفحه نمایش بسیار عظیم ۴٫۸ اینچی آن دانسته است.,16.0,2
3070,توانائی هوشمند: به منظور امنیت بیشترهارد دیسک‌های قابل حمل ای دیتا علاوه بر اینکه با توانمندی‌های سخت افزاری از جمله کیفیت بالا عملکرد قابل توجه نوآوری در طراحی، شناخته می‌شوند، نرم افزارهای با ارزشی را نیز بهمراه دارد.,41.0,3
2608,به نظرم در خریدش شک نکنید,6.0,3
2264,در عوض به مودهای عکاسی اتوماتیک، دو مود hand held night scene backlit hdr نیز افزوده شده‌اند.,19.0,3
707,اما در مورد طراحی داک آن نیز می‌خواهیم بگوییم.,10.0,2
5636,در تست تماشای ویدئو با wi-fi روشن روشنایی ثابت، retina macbook pro توانست بیش از هفت ساعت نیم شارژ دهی کند که میزان فوق‌العاده بالاییست.,27.0,4
1959,حالا می‌توانید از تمام برنامه‌های دلخواه خود در تلویزیون یا از دور لذت ببرید.,15.0,3
3702,اما صفحه کلید دیگری نیز برای این تبلت ساخته شده که type cover نام دارد بر خلاف مورد قبلی که صفحه کلید مجازی در واقع خازنی را در اختیار کاربر قرار می‌دهد، این یکی یک صفحه کلید واقعی با کلید‌های فیزیکی است که کار با آن کاملا حس کار با یک لپ تاپ را به کاربر منتقل می‌نماید.,60.0,3
1623,برای باز کردن قفل صفحه نمایش، کافیست انگشت خود را بر روی صفحه نمایش به سمت راست بکشید.,20.0,2
2407,در توضیح تعدادی از برنامه‌های پیش فرض سامسونگ باید بگوییم که برنامه note برنامه ایست که به شما در طراحی کارت با تعدادی قالب پیش فرض کمک می‌کند که می‌توانید آن‌ها را در قالب فایل pdf ذخیره نمایید.,39.0,3
938,ولی به هر صورت از آن جایی که یک دوربین point to shoot می‌باشد، مجهز به مود عکاسی intelligent auto نیز می‌باشد.,24.0,2
